{
    "name":"PropertyFile Util",
    "version":"1.3.2",
    "author":"Brad Wood",
    "location":"forgeboxStorage",
    "homepage":"https://github.com/bdw429s/PropertyFile/",
    "documentation":"https://github.com/bdw429s/PropertyFile/blob/master/readme.md",
    "repository":{
        "type":"Git",
        "URL":"https://github.com/bdw429s/PropertyFile"
    },
    "bugs":"https://github.com/bdw429s/PropertyFile/issues",
    "slug":"propertyFile",
    "shortDescription":"A library for managing Java property files",
    "type":"modules",
    "keywords":"java,property,files",
    "projectURL":"https://github.com/bdw429s/PropertyFile/",
    "scripts":{
        "postVersion":"publish",
        "postPublish":"!git push --follow-tags"
    },
    "ignore":[
        "**/.*",
        "test",
        "tests"
    ]
}