{
    "name":"CommandBox API Docs",
    "version":"1.0.0",
    "slug":"commandbox-apidocs",
    "private":true,
    "dependencies":{
        "docbox":"https://github.com/Ortus-Solutions/DocBox/archive/v5.0.2.zip"
    },
    "devDependencies":{},
    "installPaths":{
        "docbox":"docbox/"
    }
}