{
    "name":"MockDataCFC",
    "version":"3.4.0+35",
    "location":"https://downloads.ortussolutions.com/ortussolutions/coldbox-modules/MockDataCFC/3.4.0/MockDataCFC-3.4.0.zip",
    "author":"Ortus Solutions",
    "homepage":"https://github.com/Ortus-Solutions/MockDataCFC",
    "documentation":"https://github.com/Ortus-Solutions/MockDataCFC",
    "repository":{
        "type":"git",
        "URL":"https://github.com/Ortus-Solutions/MockDataCFC"
    },
    "bugs":"https://github.com/Ortus-Solutions/MockDataCFC/issues",
    "slug":"mockdatacfc",
    "shortDescription":"MockData is a service to generate fake JSON data via command line arguments, CFC calls or embedded RESTFul service",
    "type":"modules",
    "keywords":[
        "Mock Data"
    ],
    "contributors":[
        "Ray Camden",
        "Luis Majano <lmajano@ortussolutions.com>"
    ],
    "dependencies":{},
    "devDependencies":{},
    "installPaths":{},
    "ignore":[
        "**/.*",
        "test-harness",
        "*/.md"
    ],
    "scripts":{
        "release":"recipe build/release.boxr",
        "format":"cfformat run handlers,models,test-harness/tests/,ModuleConfig.cfc --overwrite",
        "format:watch":"cfformat watch handlers,models,test-harness/tests/,ModuleConfig.cfc ./.cfformat.json",
        "format:check":"cfformat check handlers,models,test-harness/tests/,ModuleConfig.cfc"
    }
}