{
    "name":"WireBox DI/AOP",
    "version":"8.0.5+33",
    "location":"https://downloads.ortussolutions.com/ortussolutions/wirebox/8.0.5/wirebox-8.0.5.zip",
    "author":"Ortus Solutions <info@ortussolutions.com>",
    "slug":"wirebox",
    "type":"di",
    "packageDirectory":"wirebox",
    "keywords":"di,aop,dependeny injection,ioc",
    "homepage":"https://www.coldbox.org",
    "documentation":"https://wirebox.ortusbooks.com",
    "repository":{
        "type":"git",
        "url":"https://github.com/coldbox/coldbox-platform"
    },
    "bugs":"https://ortussolutions.atlassian.net/browse/WIREBOX",
    "shortDescription":"AOP and Dependency Injection Framework",
    "license":[
        {
            "type":"Apache2",
            "url":"http://www.apache.org/licenses/LICENSE-2.0.html"
        }
    ],
    "contributors":[
        "Brad Wood <bdw429s@gmail.com>",
        "Curt Gratz <gratz@computerknowhow.com>"
    ],
    "ignore":[
        "**/.*",
        "tests",
        "apidocs",
        "testbox",
        "*/.md"
    ],
    "dependencies":{
        "cbproxies":"^1"
    },
    "installPaths":{
        "cbproxies":"system/async/cbproxies/"
    }
}